{
  "candidate_backlog": {
    "by_status": {
      "needs_review": 41
    },
    "total": 41
  },
  "contributor_quality": {
    "candidate_quality_command": "uv run apw candidate quality --candidates data/candidates/review",
    "intake_templates": {
      "missing_templates": [],
      "present_templates": [
        ".github/ISSUE_TEMPLATE/missing_event.yml",
        ".github/ISSUE_TEMPLATE/provider_data_correction.yml",
        ".github/ISSUE_TEMPLATE/new_source.yml",
        ".github/ISSUE_TEMPLATE/downstream_mapping.yml"
      ],
      "required_templates": [
        ".github/ISSUE_TEMPLATE/missing_event.yml",
        ".github/ISSUE_TEMPLATE/provider_data_correction.yml",
        ".github/ISSUE_TEMPLATE/new_source.yml",
        ".github/ISSUE_TEMPLATE/downstream_mapping.yml"
      ],
      "status": "pass"
    },
    "source_owner_review_path": "docs/contributors/review-workflow.md"
  },
  "correction_retraction": {
    "correction_event_count": 0,
    "issue_template": ".github/ISSUE_TEMPLATE/provider_data_correction.yml",
    "latency_status": "not_measured_until_public_issue_volume",
    "policy_path": "docs/operations/v1-governance.md#correction-and-retraction-policy",
    "retracted_or_superseded_event_count": 0,
    "target": "Document correction or retraction disposition in the next reviewed PR and release notes."
  },
  "generated_at": "2026-07-20T19:29:09Z",
  "generated_by": "ai-provider-watch 0.1.18",
  "overall_status": "warn",
  "package_version": "0.1.18",
  "policy": {
    "private_ottto_boundary": "no private Ottto UI, Advisor, telemetry, customer data, credentials, or infrastructure required",
    "publication": "operations report is visibility only and cannot publish events, tags, releases, or packages",
    "raw_provider_content": "no raw provider content is included; report contains counts, timestamps, paths, and policy refs only",
    "untrusted_input": "issue bodies, PR comments, social posts, MCP text, and provider pages remain untrusted data"
  },
  "release_train": {
    "automation_status": "dry_run_only_until_signing_equivalence",
    "cadence_target": "daily CalVer data tags after guarded automation is stable",
    "current_mode": "manual_signed_data_tags",
    "release_gates_path": "docs/operations/release-gates.md",
    "v1_governance_path": "docs/operations/v1-governance.md"
  },
  "schema_version": "apw.operations_report.v0",
  "slos": [
    {
      "actual": 8,
      "details": "Days between generated_at and the latest reviewed ProviderEvent event_date.",
      "id": "reviewed_event_freshness",
      "label": "Latest reviewed event freshness",
      "status": "pass",
      "target": 14,
      "unit": "days"
    },
    {
      "actual": 0.0,
      "details": "Hours since the latest deterministic source-state retrieval.",
      "id": "source_state_freshness",
      "label": "Source-state freshness",
      "status": "pass",
      "target": 72,
      "unit": "hours"
    },
    {
      "actual": 1.0,
      "details": "Share of enabled deterministic sources with committed source-state fingerprints.",
      "id": "enabled_source_coverage",
      "label": "Enabled source-state coverage",
      "status": "pass",
      "target": 0.8,
      "unit": "ratio"
    },
    {
      "actual": 41,
      "details": "Review candidates present outside reviewed ProviderEvent data.",
      "id": "candidate_backlog",
      "label": "Review candidate backlog",
      "status": "warn",
      "target": 0,
      "unit": "candidates"
    },
    {
      "actual": 4,
      "details": "Missing-event, correction, source, and downstream mapping templates exist.",
      "id": "public_intake_templates",
      "label": "Public feedback intake templates",
      "status": "pass",
      "target": 4,
      "unit": "templates"
    }
  ],
  "source_coverage": {
    "path": "data/feeds/coverage.json",
    "schema_version": "apw.source_coverage.v0",
    "warning_count": 1,
    "warnings": [
      {
        "code": "candidate_backlog_present",
        "detail": "41 review candidate(s) are present outside reviewed events",
        "severity": "info"
      }
    ]
  },
  "summary": {
    "candidate_backlog_count": 41,
    "enabled_deterministic_source_count": 21,
    "enabled_source_coverage_ratio": 1.0,
    "fetched_enabled_source_count": 21,
    "latest_event_date": "2026-07-12",
    "latest_reviewed_event_age_days": 8,
    "missing_enabled_source_count": 0,
    "provider_count": 5,
    "reviewed_event_count": 69,
    "source_count": 21,
    "source_state_age_hours": 0.0,
    "source_state_latest_retrieved_at": "2026-08-20T07:05:28Z",
    "warning_count": 1
  }
}
